{
  "project": "HB Track",
  "version": "1.1.0",
  "notes": "GOV_010 — AR Index Validation Checkpoint: gate permanente que prova que docs/hbtrack/ars/_INDEX.md está completo e sincronizado com todos os AR_*.md em disco. Sem código a implementar — o Executor apenas executa 'hb report 033 <cmd>', que automaticamente aciona rebuild_ar_index() como efeito colateral, depois roda a validação. Esta AR deve ser re-executada sempre que o Arquiteto suspeitar que o index está defasado. O gate é reutilizável.",
  "assumptions": [
    "rebuild_ar_index() já é invocado automaticamente por hb plan e hb report (linhas 661 e 797 do hb_cli.py)",
    "hb check (C5/E_AR_INDEX_NOT_STAGED) já bloqueia commit de AR sem _INDEX.md staged — mas não valida completude do conteúdo",
    "O Executor NÃO precisa alterar nenhum arquivo — a única ação é executar hb report com o validation_command",
    "A validação é determinística: o sistema de arquivos e o _INDEX.md não mudam entre os 3 runs do Testador",
    "_INDEX.md tem header '⚠️ Auto-gerado por hb plan/hb report. NÃO editar manualmente.'"
  ],
  "tasks": [
    {
      "id": "033",
      "title": "AR Index Checkpoint: _INDEX.md completo e sincronizado com todos AR_*.md",
      "description": "ARQUIVO ALVO: nenhum (governance checkpoint — sem alteração de código)\n\n### Problema\nO _INDEX.md é auto-gerado por hb plan e hb report, mas não existe gate que valide se ele está COMPLETO em relação a todos os AR_*.md em disco. O hb check (C5) valida apenas que o _INDEX.md está staged junto com ARs — não valida o conteúdo.\n\nRisco: se alguém criar uma AR fora do fluxo (ou se hb plan falhar no meio), o index pode ter menos entradas que o número real de ARs, gerando confusão para o Arquiteto e os agentes.\n\n### Implementação\n\nO Executor NÃO precisa alterar nenhum arquivo. A ação é:\n\n1. Executar: python scripts/run/hb_cli.py report 033 \"<validation_command_exato>\"\n   - hb report internamente chama rebuild_ar_index() ANTES de gravar o carimbo\n   - O index será reconstruído automaticamente como efeito colateral\n   - Depois o validation_command roda e valida o resultado\n\n### Por que isto funciona como gate permanente\n\nCada vez que o Arquiteto suspeitar que o index está defasado, basta:\n- Executor re-executar: hb report 033 \"<validation_command>\" --force\n- Isso reconstrói o index E valida que está completo\n- A AR vira prova auditável de que o index estava sincronizado naquele commit",
      "criteria": "1) docs/hbtrack/ars/_INDEX.md existe. 2) Todos os AR_XXX IDs presentes em AR_*.md no disco têm entrada correspondente em _INDEX.md. 3) Contagem de ARs em disco == linhas de dados no _INDEX.md (excluindo header). 4) _INDEX.md contém header '⚠️ Auto-gerado'. 5) Nenhum AR_*.md ficou de fora do index.",
      "validation_command": "python -c \"import pathlib,re; ar_dir=pathlib.Path('docs/hbtrack/ars'); files=[f for f in ar_dir.glob('AR_*.md') if '_INDEX' not in f.name]; ar_ids=set(); [ar_ids.add(m.group(1)) for f in files for m in [re.match(r'AR_([0-9]{3})',f.name)] if m]; idx=( ar_dir/'_INDEX.md').read_text(encoding='utf-8'); assert 'Auto-gerado' in idx,'FAIL: _INDEX.md nao e auto-gerado ou foi editado manualmente'; missing=[i for i in sorted(ar_ids) if f'AR_{i}' not in idx]; assert not missing,f'FAIL: ARs ausentes no index: {missing}'; rows=[l for l in idx.splitlines() if l.startswith('| AR_')]; assert len(rows)==len(ar_ids),f'FAIL: index tem {len(rows)} linhas mas disco tem {len(ar_ids)} ARs'; print(f'PASS: _INDEX.md completo — {len(ar_ids)} ARs sincronizados')\"",
      "evidence_file": "docs/hbtrack/evidence/AR_033_ar_index_validation_checkpoint.log",
      "ssot_touches": [],
      "notes": "TESTES DETERMINÍSTICOS (formato Manual Deterministico):\n\nGATE-INDEX-001: Completude\n  cmd: python -c \"import pathlib,re; ar_dir=pathlib.Path('docs/hbtrack/ars'); files=[f for f in ar_dir.glob('AR_*.md') if '_INDEX' not in f.name]; ar_ids=set(); [ar_ids.add(m.group(1)) for f in files for m in [re.match(r'AR_([0-9]{3})',f.name)] if m]; idx=(ar_dir/'_INDEX.md').read_text(encoding='utf-8'); missing=[i for i in sorted(ar_ids) if f'AR_{i}' not in idx]; assert not missing,f'FAIL: {missing}'; print(f'PASS: {len(ar_ids)} ARs no index')\"\n  PASS: 'PASS: N ARs no index' (N determinístico a cada run)\n  FAIL: 'FAIL: ARs ausentes no index: [...]'\n\nGATE-INDEX-002: Header de auto-geração intacto\n  cmd: python -c \"import pathlib; idx=pathlib.Path('docs/hbtrack/ars/_INDEX.md').read_text(encoding='utf-8'); assert 'Auto-gerado' in idx,'FAIL'; print('PASS: header ok')\"\n  PASS: 'PASS: header ok'\n  FAIL: 'AssertionError: FAIL'\n\nGATE-INDEX-003: Contagem exata (sem linhas fantasma)\n  cmd: python -c \"import pathlib,re; ar_dir=pathlib.Path('docs/hbtrack/ars'); n_files=len([f for f in ar_dir.glob('AR_*.md') if '_INDEX' not in f.name]); idx=(ar_dir/'_INDEX.md').read_text(encoding='utf-8'); n_rows=len([l for l in idx.splitlines() if l.startswith('| AR_')]); assert n_rows==n_files,f'FAIL: {n_rows} rows vs {n_files} files'; print(f'PASS: {n_rows}=={n_files}')\"\n  PASS: 'PASS: N==N'\n  FAIL: 'FAIL: M rows vs N files'",
      "risks": [
        "O validation_command conta linhas que começam com '| AR_' — se o formato do _INDEX.md mudar, o gate pode falhar erroneamente",
        "Se duas ARs tiverem o mesmo prefixo ID (ex: AR_031 e AR_031b), o gate pode dar falso positivo — IDs MUST ser únicos (enforcement via hb plan GATE 2)",
        "hb report reconstrói o index ANTES de chamar o validation_command — ordem garantida pelo hb_cli.py linha 797 então linha de execução do cmd",
        "Se rodar --force no hb report 033, o carimbo antigo é sobrescrito — isso é correto para um checkpoint reutilizável",
        "Triple-run do Testador: o filesystem não muda entre runs → stdout_hash será idêntico → triple_consistency=OK garantido"
      ]
    }
  ]
}
